user_input,retrieved_contexts,response,reference,context_recall,context_entity_recall,answer_relevancy,faithfulness,factual_correctness,semantic_similarity
"What frameworks does the ESG report follow, and are they internationally recognized (e.g., GRI, SASB, TCFD)? How well does the report align with these frameworks?","[""# GRI and Sustainability Reporting Community\n\nThe community is centered around the Global Reporting Initiative (GRI) and its role in promoting sustainability reporting practices. GRI provides frameworks and standards that enable organizations to disclose their environmental, social, and governance (ESG) impacts, while the Board of Directors oversees these reporting efforts to ensure transparency.\n\n## GRI's role in sustainability reporting\n\nThe Global Reporting Initiative (GRI) is a pivotal organization in the realm of sustainability reporting. It provides comprehensive standards and frameworks that help organizations disclose their impacts on the economy, environment, and society. By emphasizing stakeholder engagement, GRI ensures that companies effectively communicate their sustainability efforts, which is crucial for promoting transparency and accountability in corporate practices. This foundational role positions GRI as a key entity in the community focused on sustainability reporting. [Data: Entities (991), Relationships (1434)]\n\n## Importance of Sustainability Reporting\n\nSustainability Reporting is essential for organizations aiming to communicate their ESG performance and impacts. This practice not only fosters transparency but also enhances accountability in operations, which is increasingly demanded by stakeholders. The significance of sustainability reporting is underscored by its integration into corporate governance, as it allows organizations to demonstrate their commitment to sustainable practices and ethical operations. [Data: Entities (996), Relationships (412)]\n\n## Interconnection between GRI and Sustainability Reporting\n\nThe relationship between GRI and Sustainability Reporting is integral to the community's structure. GRI provides the necessary standards and guidelines that organizations use for their sustainability reporting practices. This connection ensures that the reporting is not only standardized but also aligned with best practices in sustainability, thereby enhancing the credibility of the reports produced by various organizations. [Data: Relationships (1434)]\n\n## Role of the Board of Directors in overseeing reporting\n\nThe Board of Directors plays a crucial role in overseeing Sustainability Reporting to ensure that organizations maintain transparency in their ESG matters. This oversight is vital for fostering trust among stakeholders, as it reflects the organization's commitment to ethical governance and accountability. The involvement of the Board is a key aspect of ensuring that sustainability reporting is taken seriously and that it meets the established standards. [Data: Relationships (412)]\n\n## Stakeholder engagement as a core principle\n\nStakeholder engagement is a core principle emphasized by GRI in its sustainability reporting frameworks. By focusing on effective communication with stakeholders, organizations can better understand their expectations and concerns, which can lead to improved sustainability practices. This engagement is essential for building trust and ensuring that the sustainability efforts are aligned with stakeholder values and interests. [Data: Entities (991)]"", ""# Sustainability Reporting Regulations and Indicators\n\nThis community is centered around the regulations governing the preparation and filing of sustainability reports by listed companies. The key entities include various performance indicators and appendices that guide sustainability reporting practices, highlighting the relationships between regulations, indicators, and sustainability performance information.\n\n## Regulations as the foundation for sustainability reporting\n\nThe 'Regulations Governing the Preparation and Filing of Sustainability Reports by Listed Companies' serve as the foundational framework for sustainability reporting. These regulations are designed to enhance transparency and accountability among listed companies, mandating the disclosure of performance indicators related to sustainability practices. By enforcing these regulations, companies are held to a standard that promotes better sustainability practices and reporting, which is crucial for stakeholder trust and environmental stewardship. [Data: Entities (1083); Relationships (901)]\n\n## Importance of performance indicators\n\nPerformance indicators such as Indicator 3, Indicator 4, and Indicator 5 are critical components of the sustainability reporting framework. These indicators provide measurable metrics that companies must report on, allowing stakeholders to assess their sustainability efforts effectively. The inclusion of these indicators in the regulations ensures that companies focus on specific, quantifiable aspects of their sustainability performance, thereby improving the overall quality of sustainability reports. [Data: Entities (1086, 1087, 1089); Relationships (1461, 1462, 1463)]\n\n## Role of Appendix 1-1\n\nAppendix 1-1 is a significant section within the regulations that outlines specific performance indicators for sustainability reporting. This appendix serves as a comprehensive guide for organizations, detailing the indicators they should adhere to when reporting on sustainability efforts. The presence of such an appendix underscores the structured approach to sustainability reporting, ensuring that companies provide consistent and relevant information to stakeholders. [Data: Entities (1090); Relationships (1465, 1466, 1467)]\n\n## Supplier management linked to sustainability\n\nSupplier management is intricately linked to sustainability performance information, as it ensures that suppliers meet safety and performance standards. The regulations guide supplier management practices, emphasizing the importance of evaluating suppliers based on their sustainability performance. This relationship highlights the interconnectedness of sustainability reporting and supply chain management, where companies must ensure that their suppliers also adhere to sustainability standards. [Data: Entities (1073); Relationships (1168)]\n\n## Product safety and environmental management\n\nThe regulations include chapters on product safety and environmental management, which are essential for ensuring that companies manage their environmental impact effectively. These chapters detail requirements for air, water, and waste management, as well as raw material management. By integrating product safety and environmental management into the sustainability reporting framework, the regulations promote a holistic approach to corporate responsibility. [Data: Entities (75, 1464); Relationships (75, 1469)]"", ""# Sustainability Reporting Community\n\nThe Sustainability Reporting Community is centered around the preparation and filing of Sustainability Reports by listed companies, governed by specific regulations. Key entities include Sustainability Reports, Level A Suppliers, and the regulations that dictate reporting standards, highlighting the interconnectedness of compliance, performance evaluation, and stakeholder communication.\n\n## Sustainability Reports as a core entity\n\nSustainability Reports are essential documents that companies prepare to disclose their sustainability practices and performance indicators. These reports serve as a vital communication tool for stakeholders, ensuring transparency and accountability in corporate sustainability efforts. The relationship between Sustainability Reports and regulations governing their preparation is crucial, as it ensures that companies adhere to established standards, thereby enhancing the credibility of the information provided. [Data: Entities (186), Relationships (601, 901, 900)]\n\n## Regulatory framework governing sustainability reporting\n\nThe regulations governing the preparation and filing of Sustainability Reports are fundamental to ensuring that companies provide accurate and comprehensive information regarding their sustainability practices. These regulations outline the requirements for disclosure, thereby holding companies accountable for their environmental and social impacts. The existence of such regulations indicates a structured approach to sustainability reporting, which is essential for maintaining stakeholder trust and compliance with legal standards. [Data: Entities (1119), Relationships (901, 900)]\n\n## Role of Level A Suppliers\n\nLevel A Suppliers are recognized for their high standards of quality and compliance, which are evaluated annually. Their designation as Level A indicates a commitment to sustainability practices that align with regulatory expectations. The relationship between Level A Suppliers and Sustainability Reports suggests that these suppliers are likely required to enhance their disclosures, thereby contributing to the overall transparency of the supply chain and reinforcing the importance of sustainability in procurement processes. [Data: Entities (1094), Relationships (932, 896)]\n\n## Corporate official website as a communication platform\n\nThe corporate official website plays a significant role in disseminating Sustainability Reports to stakeholders. This platform enhances transparency by providing easy access to sustainability information, which is crucial for stakeholder engagement and public accountability. The relationship between the corporate website and Sustainability Reports underscores the importance of effective communication strategies in promoting corporate sustainability initiatives. [Data: Entities (277), Relationships (895)]\n\n## Sustainable Development Unit's responsibility\n\nThe Sustainable Development Unit is tasked with the regular issuance of Sustainability Reports, highlighting its role in overseeing corporate sustainability practices. This unit ensures that reports are prepared in accordance with regulatory standards, thereby maintaining the integrity and reliability of the information disclosed. The relationship between the Sustainable Development Unit and Sustainability Reports emphasizes the importance of dedicated oversight in achieving sustainability goals. [Data: Entities (186), Relationships (887)]"", ""# Energy and Environmental Management Community\n\nThe community focuses on Energy and Environmental Management, which encompasses practices and regulations related to sustainable energy use, water resources, and waste management. Key entities include the regulations governing sustainability reporting and specific performance indicators that guide organizations in their environmental responsibilities.\n\n## Regulatory Framework for Energy and Environmental Management\n\nThe community is anchored by regulations that govern the preparation and filing of sustainability reports by listed companies. These regulations include a chapter specifically focused on energy and environmental management, which details requirements for air, water, and waste management. This regulatory framework is crucial for ensuring that organizations adhere to sustainable practices and are held accountable for their environmental impact. The emphasis on compliance highlights the significant role these regulations play in promoting responsible management of resources [Data: Relationships (1464)].\n\n## Link between Performance Indicators and Environmental Management\n\nIndicator 9 is a specific performance measure related to the energy and environmental management chapter of the regulations. This indicator serves as a benchmark for organizations to assess their sustainability practices, ensuring that they are meeting the required standards for energy use and waste management. The relationship between Indicator 9 and the energy and environmental management chapter underscores the importance of measurable performance in driving improvements in sustainability efforts [Data: Relationships (1478)].\n\n## Impact of Lin Plant's Operations\n\nLin Plant's operations are subject to regulations regarding energy use and waste management, making it a significant entity within the community. The plant's adherence to these regulations is essential for its operational sustainability and compliance with environmental standards. This relationship illustrates the practical implications of energy and environmental management regulations on specific organizations, highlighting the need for ongoing monitoring and compliance to mitigate environmental risks [Data: Relationships (1477)].\n\n## Interconnectedness of Regulations and Performance Indicators\n\nThe energy and environmental management chapter references performance indicators listed in Appendix 1-1, establishing a direct link between regulatory requirements and measurable outcomes. This interconnectedness is vital for organizations as it provides a clear framework for compliance and performance assessment. By aligning their practices with these indicators, organizations can enhance their sustainability reporting and demonstrate their commitment to environmental responsibility [Data: Relationships (1469)].\n\n## Emphasis on Sustainable Practices in Reporting\n\nThe focus on energy and environmental management within sustainability reports emphasizes the critical role these practices play in promoting sustainable operations. Organizations are encouraged to adopt comprehensive strategies for managing energy use, water resources, and waste, which are essential for achieving long-term sustainability goals. This emphasis not only supports regulatory compliance but also fosters a culture of environmental responsibility within organizations [Data: Entities (1118)]."", ""# Tairoun's Sustainable Practices and Community Engagement\n\nThe community is centered around Tairoun and its various initiatives related to sustainability, risk management, and community support. Key entities include Raw Material Management, Charity, and Risk Management and Crisis Handling Principles, all of which are interconnected through Tairoun's operational strategies and corporate social responsibility efforts.\n\n## Tairoun's commitment to sustainable raw material management\n\nTairoun implements robust raw material management practices to ensure quality in food processing, which is crucial for maintaining product safety and sustainability. This management approach not only enhances operational efficiency but also aligns with Tairoun's broader corporate sustainable development goals. The relationship between raw material management and Tairoun's production processes indicates a strong focus on minimizing waste and optimizing resource use, thereby contributing to environmental sustainability. [Data: Relationships (46, 48)]\n\n## Charity initiatives as part of corporate social responsibility\n\nTairoun engages in charitable activities and community service, reflecting its commitment to corporate social responsibility. These initiatives aim to uplift and empower vulnerable populations, fostering a sense of community and compassion. The integration of charity within Tairoun's operational framework highlights the organization's dedication to supporting individuals and communities in need, which is essential for enhancing its reputation and stakeholder trust. [Data: Relationships (50, 7)]\n\n## Risk management frameworks enhancing organizational resilience\n\nTairoun employs comprehensive risk management and crisis handling principles to identify and mitigate potential risks that could impact its operations. These frameworks are essential for ensuring that the organization is prepared to handle unforeseen challenges, thereby safeguarding its operational integrity and reputation. The implementation of these principles demonstrates Tairoun's proactive approach to risk management, which is critical in today's dynamic business environment. [Data: Relationships (57, 16)]\n\n## Sustainability reporting as a transparency tool\n\nTairoun publishes a sustainability report that discloses its governance and sustainability practices, enhancing transparency and accountability. This report includes various performance indicators and highlights key areas such as product safety, employee health and safety, and environmental management. The emphasis on sustainability reporting not only fulfills regulatory requirements but also strengthens stakeholder confidence in Tairoun's commitment to responsible business practices. [Data: Relationships (19, 1, 3)]\n\n## Integration of GRI Standards in sustainability efforts\n\nThe incorporation of the GRI Standards Index into Tairoun's sustainability report aligns its disclosures with global standards, ensuring a comprehensive approach to sustainability reporting. This integration emphasizes Tairoun's commitment to adhering to established guidelines for transparency and accountability, which is vital for building trust with stakeholders and enhancing its corporate reputation. [Data: Relationships (2)]\n\n## Social welfare initiatives promoting community engagement\n\nTairoun's social welfare and participation initiatives are designed to improve the well-being of communities and encourage public engagement. These programs reflect the organization's commitment to fostering a supportive environment for vulnerable populations, thereby enhancing its social impact. The focus on social care initiatives within the sustainability report underscores Tairoun's dedication to community upliftment and social responsibility. [Data: Relationships (4, 8)]""]","The frameworks followed by Environmental, Social, and Governance (ESG) reports are essential for ensuring that organizations disclose their sustainability practices and impacts in a transparent and standardized manner. Notable internationally recognized frameworks include the Global Reporting Initiative (GRI), the Sustainability Accounting Standards Board (SASB), and the Task Force on Climate-related Financial Disclosures (TCFD).

The **Global Reporting Initiative (GRI)** is a prominent framework that provides comprehensive guidelines for organizations to report on their environmental, social, and governance (ESG) impacts. GRI emphasizes stakeholder engagement and transparency, encouraging companies to disclose their sustainability efforts in a way that is relevant to their stakeholders. Many organizations adopt GRI standards to ensure their reports are aligned with best practices in sustainability reporting.

**SASB** focuses specifically on the financial materiality of sustainability information, providing industry-specific standards that help organizations disclose relevant ESG factors that may impact financial performance. This framework is particularly useful for investors seeking to understand the sustainability risks and opportunities associated with specific sectors.

**TCFD** emphasizes the importance of climate-related disclosures, guiding organizations on how to report climate-related financial risks and opportunities. It encourages firms to provide transparent information about governance, strategy, risk management, and metrics related to climate change.

The alignment of ESG reports with these frameworks varies based on the organization’s commitment to sustainability and the regulatory requirements they must adhere to. Many companies, such as Tairoun, incorporate GRI standards into their sustainability reports, demonstrating a commitment to international guidelines. This integration not only enhances the credibility of the information disclosed but also ensures that the reports meet the expectations of stakeholders regarding transparency and accountability.

Overall, the effectiveness of an ESG report in adhering to these frameworks is crucial for fostering stakeholder trust and demonstrating a genuine commitment to sustainable practices. Organizations that rigorously follow GRI, SASB, and TCFD guidelines are better positioned to communicate their sustainability efforts and address the growing demand for accountability in corporate practices.","### **Frameworks Followed in the ESG Report**

The ESG report of Tairoun Products Co., Ltd. adheres to internationally recognized frameworks to ensure the credibility and comprehensiveness of its sustainability disclosures. Specifically, the report follows:

1. **Global Reporting Initiative (GRI) Standards**:
   - The report is drafted in accordance with the GRI Standards issued by the Global Reporting Initiative, as highlighted in the editorial principles section. It adopts a core disclosure approach, focusing on material topics relevant to stakeholders and aligned with global sustainability practices.

2. **Third-Party Assurance**:
   - To enhance reliability, the report undergoes independent limited assurance by BDO Taiwan Union & Co. This assurance aligns with GAAP 3000 (""Assurance Engagements other than Audits or Reviews of Historical Financial Information""), which underscores its compliance with international assurance standards.

3. **ISO Standards**:
   - The company integrates ISO standards into its operations, including ISO 22000 for food safety management and ISO 9001 for quality management. These certifications reflect a commitment to internationally accepted operational and reporting practices.

---

### **Alignment with Frameworks**

#### **Strengths**:

1. **Robust Data Collection and Disclosure**:
   - Tairoun follows structured data collection and measurement methods aligned with GRI Standards, ensuring compliance with local regulations or, where applicable, international and industry-specific standards.

2. **Third-Party Verification**:
   - The engagement of an independent assurance provider reinforces the credibility of the report. By adhering to GAAP 3000, the company demonstrates its commitment to transparency and accountability.

3. **Integration of ISO Standards**:
   - The adoption of ISO standards, particularly in food safety and quality management, reflects a strong alignment with best practices in operational and sustainability management.

4. **Transparency in Material Issues**:
   - The report incorporates stakeholder concerns into its materiality assessment, guided by GRI’s material topics framework. This ensures a balanced approach to addressing economic, environmental, and social impacts.

---

#### **Areas for Improvement**:

1. **Broader Framework Integration**:
   - While the report adheres to GRI Standards and ISO certifications, it does not explicitly reference frameworks such as the Sustainability Accounting Standards Board (SASB) or the Task Force on Climate-related Financial Disclosures (TCFD). Including these could enhance the report's relevance to global investors and climate-related risk disclosures.

2. **Clearer SDG Alignment**:
   - Although the company outlines its sustainable development strategies, a detailed mapping of contributions to the United Nations Sustainable Development Goals (SDGs) would provide greater clarity and alignment with global sustainability agendas.

3. **Enhanced Assurance Scope**:
   - While third-party assurance is provided, extending its scope to cover more non-financial indicators would further enhance stakeholder confidence in the disclosed data.

---

### **Conclusion**

Tairoun Products Co., Ltd. demonstrates a strong commitment to sustainability reporting by adhering to GRI Standards, leveraging third-party assurance, and aligning its operational processes with ISO standards. However, the report could benefit from integrating additional internationally recognized frameworks like SASB and TCFD and providing detailed SDG mapping to enhance its global relevance and comprehensiveness.",0.6875,0.0,0.8250871251190416,0.6470588235294118,0.47,0.7390195764385705
